{
  "version": "0.1.0",
  "vocabulary_release": "urn:agent-sem:vocabulary:0.1.0",
  "status": "design_baseline",
  "common_candidate_gates": [
    "authenticated_workspace_scope",
    "authorized_visibility",
    "retrieval_deletion_deny",
    "permitted_source_lineage",
    "registered_purpose_lifecycle_policy"
  ],
  "common_delivery_gates": [
    "rejoin_current_access",
    "rejoin_deletion_and_lifecycle",
    "recheck_purpose_applicability",
    "retain_source_and_evidence_origin"
  ],
  "gate_note": "Do not globally require applicability=true for discovery. Unknown precedents, historical norms and potential conflicts may be eligible as explicitly qualified evidence under the authorized purpose; they cannot become current binding guidance automatically.",
  "ranking": {
    "method": "rrf",
    "k": 60,
    "family_total_weights": {
      "exact": 1,
      "lexical": 1,
      "dense": 1,
      "structural": 1,
      "relations": 1
    },
    "correlated_channel_rule": "Split the family total among successful active channels using a recorded policy; adding another dense view does not add a new family vote. These weights and k are initial evaluation settings. Required enumeration and mandatory context are outside ranking competition.",
    "deduplicate": "For relevance candidate lists, deduplicate retrieved revision views while retaining frame IDs and contributing ranks. Independently group originating evidence before support assessment. Type inventory bypasses RRF and revision-view deduplication: retain every distinct typed occurrence in manifest order. Compliance retains every enumerated obligation."
  },
  "default_limits": {
    "graph_max_depth": 4,
    "graph_max_nodes": 500,
    "candidate_limit_note": "Starting design budgets to evaluate; zero denotes mandatory exact/registry/enumeration work with explicit exhaustion handling, never zero returned results."
  },
  "space_resolution": "Resolve logical view names to pinned input serializers and compatible registered space generations before execution. Record every resolved identity, exact encoding input hash and missing channel.",
  "question_storage": "need_query_views reference existing need_revisions. Query embeddings key retrieval_run, need revision, exact encoding-input hash and space generation; indexed evidence stays in memory_embeddings. No accepted memory is created merely to encode a question.",
  "result_contract": [
    "retrieval_ranks_and_score_provenance",
    "applicability_result_and_inputs",
    "profile_decision_and_evaluator",
    "coverage_and_truncation",
    "source_revision_and_evidence_lineage",
    "independent_execution_eligibility_if_relevant"
  ],
  "failure_policy": "Required channel failures stay explicit and block conclusions that depend on them. Optional channel failure records degraded coverage under the declared profile; incompatible spaces are rejected.",
  "profiles": [
    {
      "id": "urn:agent-sem:retrieval-profile:type_inventory:0.1.0",
      "name": "type_inventory",
      "question": "Find every item of the specified registered type",
      "match_intents": [
        "type_inventory"
      ],
      "required_inputs": [
        "type_query",
        "authorized_scope"
      ],
      "channels": [
        {
          "id": "type_registry",
          "kind": "exact",
          "family": "exact",
          "view": "published_type_definition_and_explicit_subtype_closure",
          "required": true,
          "candidate_limit": 0
        },
        {
          "id": "type_manifest",
          "kind": "direct_enumeration",
          "family": "exact",
          "view": "frozen_ordered_typed_occurrence_manifest",
          "required": true,
          "candidate_limit": 0
        }
      ],
      "decision": {
        "evaluator_id": "type_inventory-decision-0.1.0",
        "requirements": [
          "one_primary_type_per_occurrence_generation",
          "checked_source_ownership",
          "consistent_source_and_catalog_snapshot",
          "explicit_ingestion_classification_itemisation_coverage",
          "current_access_and_deletion_recheck",
          "authenticated_stable_cursor"
        ],
        "allowed_results": [
          "complete_enumeration",
          "partial_enumeration",
          "coverage_requires_work",
          "invalidated_snapshot"
        ]
      },
      "coverage_rule": "Enumeration has no top-k cutoff. Distinguish source ingestion, classification, nested-item materialisation, selection and delivery completeness; missing child rows are a coverage gap even without unresolved item rows.",
      "notes": "Exact primary-type equality is the default; include descendants only through the published type graph. Contains is not is_a. A changed eligibility boundary invalidates continuation; current authorization always governs delivery."
    },
    {
      "id": "urn:agent-sem:retrieval-profile:aboutness:0.1.0",
      "name": "aboutness",
      "question": "What is this about?",
      "match_intents": [
        "general_relevance"
      ],
      "required_inputs": [
        "question",
        "authorized_scope"
      ],
      "channels": [
        {
          "id": "identifiers",
          "kind": "exact",
          "family": "exact",
          "view": "checked_entity_identifiers",
          "required": false,
          "candidate_limit": 100
        },
        {
          "id": "lexical",
          "kind": "fts",
          "family": "lexical",
          "view": "source_text",
          "required": false,
          "candidate_limit": 100
        },
        {
          "id": "general_text",
          "kind": "dense",
          "family": "dense",
          "view": "general_text",
          "required": false,
          "candidate_limit": 100
        },
        {
          "id": "concepts",
          "kind": "feature_postings",
          "family": "structural",
          "view": "concept_and_role_features",
          "required": false,
          "candidate_limit": 100
        }
      ],
      "decision": {
        "evaluator_id": "aboutness-decision-0.1.0",
        "requirements": [
          "common_candidate_gates",
          "source_provenance"
        ],
        "allowed_results": [
          "relevant_candidate"
        ]
      },
      "coverage_rule": "Report candidate limits, index coverage and unavailable channels. If all channels fail, the retrieval run status is failed and no relevance decision is emitted.",
      "notes": "Relevance is not truth, equivalence or current applicability."
    },
    {
      "id": "urn:agent-sem:retrieval-profile:same_meaning:0.1.0",
      "name": "same_meaning",
      "question": "Does this express the same statement?",
      "match_intents": [
        "same_statement",
        "equivalent_meaning"
      ],
      "required_inputs": [
        "target_statement_refs",
        "authorized_scope"
      ],
      "channels": [
        {
          "id": "canonical",
          "kind": "exact",
          "family": "exact",
          "view": "statement_hash_and_retained_bytes",
          "required": true,
          "candidate_limit": 100
        },
        {
          "id": "structure",
          "kind": "feature_postings",
          "family": "structural",
          "view": "joint_atom_and_role_bindings",
          "required": true,
          "candidate_limit": 100
        },
        {
          "id": "lexical",
          "kind": "fts",
          "family": "lexical",
          "view": "source_text",
          "required": false,
          "candidate_limit": 100
        },
        {
          "id": "general_text",
          "kind": "dense",
          "family": "dense",
          "view": "meaning_paraphrase_view",
          "required": false,
          "candidate_limit": 100
        }
      ],
      "decision": {
        "evaluator_id": "same_meaning-decision-0.1.0",
        "requirements": [
          "resolved_typed_entities",
          "complete_source_mapping",
          "compatible_vocabulary",
          "preserved_polarity_modality_conditions_scope_time",
          "registered_canonical_rules"
        ],
        "allowed_results": [
          "same_statement",
          "same_proposition_different_qualifiers",
          "different_statement",
          "undetermined"
        ]
      },
      "coverage_rule": "Missing complete interpretation or a required comparison input produces undetermined. Do not claim universal logical equivalence from canonical mismatch.",
      "notes": "Dense candidates and matching partial extraction bytes cannot establish exact meaning. The source interpretation itself requires coverage checks."
    },
    {
      "id": "urn:agent-sem:retrieval-profile:applicable_procedure:0.1.0",
      "name": "applicable_procedure",
      "question": "What method might solve this problem?",
      "match_intents": [
        "applicable_precedent"
      ],
      "required_inputs": [
        "question",
        "target_context",
        "authorized_scope"
      ],
      "channels": [
        {
          "id": "procedure_fields",
          "kind": "feature_postings",
          "family": "structural",
          "view": "trigger_preconditions_diagnostics_verification",
          "required": true,
          "candidate_limit": 100
        },
        {
          "id": "lexical",
          "kind": "fts",
          "family": "lexical",
          "view": "procedure_text",
          "required": false,
          "candidate_limit": 100
        },
        {
          "id": "general_text",
          "kind": "dense",
          "family": "dense",
          "view": "procedure_rendered_view",
          "required": false,
          "candidate_limit": 100
        },
        {
          "id": "procedure_neighbors",
          "kind": "typed_relations",
          "family": "relations",
          "view": "prerequisites_exceptions_qualifications",
          "required": true,
          "candidate_limit": 100
        }
      ],
      "decision": {